paper_id,year,category,title,abstract,keywords,group_num,group_name,topic_id,topic_name,r1_terms,r1_term_count,annot_missing_terms,annot_important_terms,model_r2_terms,model_additional_terms,combined_important_terms
7066,2019,COMPUTER SCIENCE,FusionGAN: A generative adversarial network for infrared and visible image fusion,"Infrared images can distinguish targets from their backgrounds on the basis of difference in thermal radiation, which works well at all day/night time and under all weather conditions. By contrast, visible images can provide texture details with high spatial resolution and definition in a manner consistent with the human visual system. This paper proposes a novel method to fuse these two types of information using a generative adversarial network, termed as FusionGAN. Our method establishes an adversarial game between a generator and a discriminator, where the generator aims to generate a fused image with major infrared intensities together with additional visible gradients, and the discriminator aims to force the fused image to have more details existing in visible images. This enables that the final fused image simultaneously keeps the thermal radiation in an infrared image and the textures in a visible image. In addition, our FusionGAN is an end-to-end model, avoiding manually designing complicated activity level measurements and fusion rules as in traditional methods. Experiments on public datasets demonstrate the superiority of our strategy over state-of-the-arts, where our results look like sharpened infrared images with clear highlighted targets and abundant details. Moreover, we also generalize our FusionGAN to fuse images with different resolutions, say a low-resolution infrared image and a high-resolution visible image. Extensive results demonstrate that our strategy can generate clear and clean fused images which do not suffer from noise caused by upsampling of infrared information.",Image fusion; Infrared image; Visible image; Generative adversarial network; Deep learning; MULTISCALE-DECOMPOSITION; PERFORMANCE; TRANSFORM; LIGHT; FOCUS,10,Machine Vision,112,Computer Vision and Multimodal Learning in Behavior Recognition,FusionGAN; generative adversarial network; infrared and visible image fusion; adversarial game; end-to-end model; activity level measurements; fusion rules; low-resolution infrared image; high-resolution visible image,9,,FusionGAN,fusion rules,fusion rules,fusiongan; fusion rules
7099,2019,CHEMISTRY,A Comprehensive Survey of Vision-Based Human Action Recognition Methods,"Although widely used in many applications, accurate and efficient human action recognition remains a challenging area of research in the field of computer vision. Most recent surveys have focused on narrow problems such as human action recognition methods using depth data, 3D-skeleton data, still image data, spatiotemporal interest point-based methods, and human walking motion recognition. However, there has been no systematic survey of human action recognition. To this end, we present a thorough review of human action recognition methods and provide a comprehensive overview of recent approaches in human action recognition research, including progress in hand-designed action features in RGB and depth data, current deep learning-based action feature representation methods, advances in human-object interaction recognition methods, and the current prominent research topic of action detection methods. Finally, we present several analysis recommendations for researchers. This survey paper provides an essential reference for those interested in further research on human action recognition.",action detection; action feature; human action recognition; human-object interaction recognition; systematic survey; 3D ACTION RECOGNITION; REPRESENTATION; ROBUST; NETWORKS,10,Machine Vision,112,Computer Vision and Multimodal Learning in Behavior Recognition,vision-based human action recognition; depth data; 3D-skeleton data; still image data; spatiotemporal interest point-based methods; human walking motion recognition; hand-designed action features; RGB and depth data; deep learning-based action feature representation; human-object interaction recognition; action detection methods,11,,,deep learning-based action feature representation,deep learning-based action feature representation,deep learning-based action feature representation
7207,2023,ENGINEERING,MS-TCN plus plus : Multi-Stage Temporal Convolutional Network for Action Segmentation,"With the success of deep learning in classifying short trimmed videos, more attention has been focused on temporally segmenting and classifying activities in long untrimmed videos. State-of-the-art approaches for action segmentation utilize several layers of temporal convolution and temporal pooling. Despite the capabilities of these approaches in capturing temporal dependencies, their predictions suffer from over-segmentation errors. In this paper, we propose a multi-stage architecture for the temporal action segmentation task that overcomes the limitations of the previous approaches. The first stage generates an initial prediction that is refined by the next ones. In each stage we stack several layers of dilated temporal convolutions covering a large receptive field with few parameters. While this architecture already performs well, lower layers still suffer from a small receptive field. To address this limitation, we propose a dual dilated layer that combines both large and small receptive fields. We further decouple the design of the first stage from the refining stages to address the different requirements of these stages. Extensive evaluation shows the effectiveness of the proposed model in capturing long-range dependencies and recognizing action segments. Our models achieve state-of-the-art results on three datasets: 50Salads, Georgia Tech Egocentric Activities (GTEA), and the Breakfast dataset.",Videos; Hidden Markov models; Convolution; Task analysis; Computer architecture; Microsoft Windows; Adaptation models; Temporal action segmentation; temporal convolutional network,10,Machine Vision,112,Computer Vision and Multimodal Learning in Behavior Recognition,Multi-Stage Temporal Convolutional Network; temporal convolution; temporal pooling; dilated temporal convolutions; dual dilated layer; long-range dependencies; action segmentation; temporal action segmentation; receptive field,9,,MS-TCN++; dual dilated layer,multi-stage temporal convolutional network; temporal convolution; temporal pooling; dilated temporal convolutions,multi-stage temporal convolutional network; temporal convolution; temporal pooling; dilated temporal convolutions,ms-tcn++; dual dilated layer; multi-stage temporal convolutional network; temporal convolution; temporal pooling; dilated temporal convolutions
7328,2017,ENGINEERING,Long-Term Recurrent Convolutional Networks for Visual Recognition and Description,"Models based on deep convolutional networks have dominated recent image interpretation tasks; we investigate whether models which are also recurrent are effective for tasks involving sequences, visual and otherwise. We describe a class of recurrent convolutional architectures which is end-to-end trainable and suitable for large-scale visual understanding tasks, and demonstrate the value of these models for activity recognition, image captioning, and video description. In contrast to previous models which assume a fixed visual representation or perform simple temporal averaging for sequential processing, recurrent convolutional models are ""doubly deep"" in that they learn compositional representations in space and time. Learning long-term dependencies is possible when nonlinearities are incorporated into the network state updates. Differentiable recurrent models are appealing in that they can directly map variable-length inputs (e.g., videos) to variable-length outputs (e.g., natural language text) and can model complex temporal dynamics; yet they can be optimized with backpropagation. Our recurrent sequence models are directly connected to modern visual convolutional network models and can be jointly trained to learn temporal dynamics and convolutional perceptual representations. Our results show that such models have distinct advantages over state-of-the-art models for recognition or generation which are separately defined or optimized.",Computer vision; convolutional nets; deep learning; transfer learning,10,Machine Vision,112,Computer Vision and Multimodal Learning in Behavior Recognition,Long-Term Recurrent Convolutional Networks; recurrent convolutional architectures; end-to-end trainable; large-scale visual understanding; activity recognition; image captioning; video description; temporal averaging; doubly deep; compositional representations; long-term dependencies; nonlinearities; network state updates; Differentiable recurrent models; variable-length inputs; variable-length outputs; complex temporal dynamics; backpropagation; recurrent sequence models; visual convolutional network models; jointly trained; temporal dynamics; convolutional perceptual representations,23,,Long-Term Recurrent Convolutional Networks,long-term recurrent convolutional networks; activity recognition; video description; temporal averaging; doubly deep; compositional representations; long-term dependencies; differentiable recurrent models; recurrent sequence models; visual convolutional network models; temporal dynamics,activity recognition; video description; temporal averaging; doubly deep; compositional representations; differentiable recurrent models; recurrent sequence models; visual convolutional network models; temporal dynamics,long-term recurrent convolutional networks; activity recognition; video description; temporal averaging; doubly deep; compositional representations; differentiable recurrent models; recurrent sequence models; visual convolutional network models; temporal dynamics
7599,2017,ENGINEERING,Going deeper into action recognition: A survey,"Understanding human actions in visual data is tied to advances in complementary research areas including object recognition, human dynamics, domain adaptation and semantic segmentation. Over the last decade, human action analysis evolved from earlier schemes that are often limited to controlled environments to nowadays advanced solutions that can learn from millions of videos and apply to almost all daily activities. Given the broad range of applications from video surveillance to human-computer interaction, scientific milestones in action recognition are achieved more rapidly, eventually leading to the demise of what used to be good in a short time. This motivated us to provide a comprehensive review of the notable steps taken towards recognizing human actions. To this end, we start our discussion with the pioneering methods that use handcrafted representations, and then, navigate into the realm of deep learning based approaches. We aim to remain objective throughout this survey, touching upon encouraging improvements as well as inevitable fallbacks, in the hope of raising fresh questions and motivating new research directions for the reader. (C) 2017 Elsevier B.V. All rights reserved.",Human action recognition; Motion recognition; Survey; Deep networks; MOTION; CLASSIFICATION; REPRESENTATION; MOVEMENTS; MODEL; SCALE,10,Machine Vision,112,Computer Vision and Multimodal Learning in Behavior Recognition,handcrafted representations; deep learning based approaches; human action analysis; object recognition; human dynamics; domain adaptation; semantic segmentation,7,,,handcrafted representations; object recognition,handcrafted representations; object recognition,handcrafted representations; object recognition
8013,2021,ENGINEERING,Feature Refinement and Filter Network for Person Re-Identification,"In the task of person re-identification, the attention mechanism and fine-grained information have been proved to be effective. However, it has been observed that models often focus on the extraction of features with strong discrimination, and neglect other valuable features. The extracted fine-grained information may include redundancies. In addition, current methods lack an effective scheme to remove background interference. Therefore, this paper proposes the feature refinement and filter network to solve the above problems from three aspects: first, by weakening the high response features, we aim to identify highly valuable features and extract the complete features of persons, thereby enhancing the robustness of the model; second, by positioning and intercepting the high response areas of persons, we eliminate the interference arising from background information and strengthen the response of the model to the complete features of persons; finally, valuable fine-grained features are selected using a multi-branch attention network for person re-identification to enhance the performance of the model. Our extensive experiments on the benchmark Market-1501, DukeMTMC-reID, CUHK03 and MSMT17 person re-identification datasets demonstrate that the performance of our method is comparable to that of state-of-the-art approaches.",Feature extraction; Task analysis; Interference; Image recognition; Training; Robustness; Information filters; Person re-identification; deep learning; attention; Person Search; ATTENTION,10,Machine Vision,112,Computer Vision and Multimodal Learning in Behavior Recognition,feature refinement and filter network; attention mechanism; fine-grained information; multi-branch attention network; high response features; background interference elimination,6,,feature refinement and filter network,feature refinement and filter network; attention mechanism; multi-branch attention network,attention mechanism; multi-branch attention network,feature refinement and filter network; attention mechanism; multi-branch attention network
8342,2019,ENGINEERING,CamStyle: A Novel Data Augmentation Method for Person Re-Identification,"Person re-identification (re-ID) is a cross-camera retrieval task that suffers from image style variations caused by different cameras. The art implicitly addresses this problem by learning a camera-invariant descriptor subspace. In this paper, we explicitly consider this challenge by introducing camera style (CamStyle). CamStyle can serve as a data augmentation approach that reduces the risk of deep network overfitting and that smooths the CamStyle disparities. Specifically, with a style transfer model, labeled training images can be style transferred to each camera, and along with the original training samples, form the augmented training set. This method, while increasing data diversity against overfitting, also incurs a considerable level of noise. In the effort to alleviate the impact of noise, the label smooth regularization (LSR) is adopted. The vanilla version of our method (without LSR) performs reasonably well on few camera systems in which overfitting often occurs. With LSR, we demonstrate consistent improvement in all systems regardless of the extent of overfitting. We also report competitive accuracy compared with the state of the art on Market-1501 and DukeMTMC-re-ID. Importantly, CamStyle can be employed to the challenging problems of one view learning and unsupervised domain adaptation (UDA) in person re-identification (re-ID), both of which have critical research and application significance. The former only has labeled data in one camera view and the latter only has labeled data in the source domain. Experimental results show that CamStyle significantly improves the performance of the baseline in the two problems. Specially, for UDA, CamStyle achieves state-of-the-art accuracy based on a baseline deep re-ID model on Market-1501 and DukeMTMC-reID. Our code is available at: https://github.com/zhunzhong07/CamStyle.",Person re-identification; CamStyle; one-view learning; unsupervised domain adaptation; DOMAIN ADAPTATION; NETWORKS; TRACKING,10,Machine Vision,112,Computer Vision and Multimodal Learning in Behavior Recognition,CamStyle; data augmentation; style transfer model; label smooth regularization; one view learning; unsupervised domain adaptation; deep re-ID model,7,,CamStyle; label smooth regularization,deep re-id model,deep re-id model,label smooth regularization; camstyle; deep re-id model
8790,2023,COMPUTER SCIENCE,Facial Expression Recognition With Visual Transformers and Attentional Selective Fusion,"Facial Expression Recognition (FER) in the wild is extremely challenging due to occlusions, variant head poses, face deformation and motion blur under unconstrained conditions. Although substantial progresses have been made in automatic FER in the past few decades, previous studies were mainly designed for lab-controlled FER. Real-world occlusions, variant head poses and other issues definitely increase the difficulty of FER on account of these information-deficient regions and complex backgrounds. Different from previous pure CNNs based methods, we argue that it is feasible and practical to translate facial images into sequences of visual words and perform expression recognition from a global perspective. Therefore, we propose the Visual Transformers with Feature Fusion (VTFF) to tackle FER in the wild by two main steps. First, we propose the attentional selective fusion (ASF) for leveraging two kinds of feature maps generated by two-branch CNNs. The ASF captures discriminative information by fusing multiple features with the global-local attention. The fused feature maps are then flattened and projected into sequences of visual words. Second, inspired by the success of Transformers in natural language processing, we propose to model relationships between these visual words with the global self-attention. The proposed method is evaluated on three public in-the-wild facial expression datasets (RAF-DB, FERPlus and AffectNet). Under the same settings, extensive experiments demonstrate that our method shows superior performance over other methods, setting new state of the art on RAF-DB with 88.14%, FERPlus with 88.81% and AffectNet with 61.85%. The cross-dataset evaluation on CK+ shows the promising generalization capability of the proposed method.",Face recognition; Feature extraction; Transformers; Visualization; Image recognition; Head; Task analysis; Facial expression recognition in the wild; global-local attention; transformers; global self-attention,10,Machine Vision,112,Computer Vision and Multimodal Learning in Behavior Recognition,Visual Transformers; Attentional Selective Fusion; Feature Fusion; two-branch CNNs; global-local attention; global self-attention; sequences of visual words,7,,VTFF; Attentional Selective Fusion,visual transformers; attentional selective fusion; feature fusion; global-local attention; global self-attention,visual transformers; global-local attention; global self-attention,vtff; attentional selective fusion; visual transformers; global-local attention; global self-attention
8856,2016,COMPUTER SCIENCE,Sequential three-way decision and granulation for cost-sensitive face recognition,"Many previous studies on face recognition attempted to seek a precise classifier to achieve a low misclassification error, which is based on an assumption that all misclassification costs are the same. In many real-world scenarios, however, this assumption is not reasonable due to the imbalanced misclassification cost and insufficient high-quality facial image information. To address this issue, we propose a sequential three-way decision method for cost-sensitive face recognition. The proposed method is based on a formal description of granular computing. It develops a sequential strategy in a decision process. In each decision step, it seeks a decision which minimizes the misclassification cost rather than misclassification error, and it incorporates the boundary decision into the decision set such that a delayed decision can be made if available high-quality facial image information is insufficient for a precise decision. To describe the granular information of the facial image in three-way decision steps, we develop a series of image granulation methods based on two-dimensional subspace projection methods including 2DPCA, 2DLDA and 2DLPP. The sequential three-way decisions and granulation methods present an applicable simulation on human decisions in face recognition, which simulate a sequential decision strategy from rough granule to precise granule. The experiments were conducted on two popular facial image database, which validated the effectiveness of the proposed methods. (C) 2015 Elsevier B.V. All rights reserved.",Three-way decisions; Decision-theoretic rough sets; Granular computing; Cost-sensitive learning; Face recognition; THEORETIC ROUGH SET; ATTRIBUTE REDUCTION; FEATURE-SELECTION; SHADOWED SETS; FUZZY-SETS; MODEL; SYSTEMS; APPROXIMATIONS; EIGENFACES; RULES,10,Machine Vision,112,Computer Vision and Multimodal Learning in Behavior Recognition,sequential three-way decision; cost-sensitive face recognition; granular computing; boundary decision; image granulation methods; two-dimensional subspace projection; 2DPCA; 2DLDA; 2DLPP,9,,sequential three-way decision,,,sequential three-way decision
9152,2017,ENGINEERING,Visual Genome: Connecting Language and Vision Using Crowdsourced Dense Image Annotations,"Despite progress in perceptual tasks such as image classification, computers still perform poorly on cognitive tasks such as image description and question answering. Cognition is core to tasks that involve not just recognizing, but reasoning about our visual world. However, models used to tackle the rich content in images for cognitive tasks are still being trained using the same datasets designed for perceptual tasks. To achieve success at cognitive tasks, models need to understand the interactions and relationships between objects in an image. When asked ""What vehicle is the person riding?"", computers will need to identify the objects in an image as well as the relationships riding(man, carriage) and pulling(horse, carriage) to answer correctly that ""the person is riding a horse-drawn carriage."" In this paper, we present the Visual Genome dataset to enable the modeling of such relationships. We collect dense annotations of objects, attributes, and relationships within each image to learn these models. Specifically, our dataset contains over 108K images where each image has an average of objects, attributes, and pairwise relationships between objects. We canonicalize the objects, attributes, relationships, and noun phrases in region descriptions and questions answer pairs to WordNet synsets. Together, these annotations represent the densest and largest dataset of image descriptions, objects, attributes, relationships, and question answer pairs.",Computer vision; Dataset; Image; Scene graph; Question answering; Objects; Attributes; Relationships; Knowledge; Language; Crowdsourcing; DATABASE; KNOWLEDGE; WORDNET; OBJECT,10,Machine Vision,112,Computer Vision and Multimodal Learning in Behavior Recognition,dense image annotations; cognitive tasks; image description; question answering; object relationships; attribute relationships; WordNet synsets; region descriptions; pairwise relationships,9,,Visual Genome,region descriptions,region descriptions,visual genome; region descriptions
9183,2014,ENGINEERING,Face Alignment by Explicit Shape Regression,"We present a very efficient, highly accurate, ""Explicit Shape Regression"" approach for face alignment. Unlike previous regression-based approaches, we directly learn a vectorial regression function to infer the whole facial shape (a set of facial landmarks) from the image and explicitly minimize the alignment errors over the training data. The inherent shape constraint is naturally encoded into the regressor in a cascaded learning framework and applied from coarse to fine during the test, without using a fixed parametric shape model as in most previous methods. To make the regression more effective and efficient, we design a two-level boosted regression, shape indexed features and a correlation-based feature selection method. This combination enables us to learn accurate models from large training data in a short time (20 min for 2,000 training images), and run regression extremely fast in test (15 ms for a 87 landmarks shape). Experiments on challenging data show that our approach significantly outperforms the state-of-the-art in terms of both accuracy and efficiency.",Face alignment; Shape indexed feature; Correlation based feature selection; Non-parametric shape constraint; Tow-level boosted regression; MODELS,10,Machine Vision,112,Computer Vision and Multimodal Learning in Behavior Recognition,Explicit Shape Regression; vectorial regression function; cascaded learning framework; two-level boosted regression; shape indexed features; correlation-based feature selection,6,,Explicit Shape Regression,shape indexed features; correlation-based feature selection,shape indexed features; correlation-based feature selection,explicit shape regression; shape indexed features; correlation-based feature selection
