paper_id,year,category,title,abstract,keywords,group_num,group_name,topic_id,topic_name,r1_terms,r1_term_count,annot_missing_terms,annot_important_terms,model_r2_terms,model_additional_terms,combined_important_terms
28,2021,ENGINEERING,Hypergraph convolution and hypergraph attention,"Recently, graph neural networks have attracted great attention and achieved prominent performance in various research fields. Most of those algorithms have assumed pairwise relationships of objects of in-terest. However, in many real applications, the relationships between objects are in higher-order, beyond a pairwise formulation. To efficiently learn deep embeddings on the high-order graph-structured data, we introduce two end-to-end trainable operators to the family of graph neural networks, i.e., hypergraph convolution and hypergraph attention. Whilst hypergraph convolution defines the basic formulation of performing convolution on a hypergraph, hypergraph attention further enhances the capacity of representation learning by leveraging an attention module. With the two operators, a graph neural network is readily extended to a more flexible model and applied to diverse applications where non-pairwise relationships are observed. Extensive experimental results with semi-supervised node classification demonstrate the effectiveness of hypergraph convolution and hypergraph attention. (c) 2020 Elsevier Ltd. All rights reserved.",Graph learning; Hypergraph learning; Graph neural networks; Semi-supervised learning; GRAPH,16,AI Fundamental Research,73,Deep Learning and Neural Networks,hypergraph convolution; hypergraph attention; graph neural networks; semi-supervised node classification; attention module; high-order graph-structured data; end-to-end trainable operators,7,,hypergraph convolution; hypergraph attention,hypergraph convolution; hypergraph attention; graph neural networks; semi-supervised node classification; attention module; high-order graph-structured data,graph neural networks; semi-supervised node classification; high-order graph-structured data,hypergraph attention; hypergraph convolution; graph neural networks; semi-supervised node classification; high-order graph-structured data
53,2019,COMPUTER SCIENCE,Designing neural networks through neuroevolution,"Much of recent machine learning has focused on deep learning, in which neural network weights are trained through variants of stochastic gradient descent. An alternative approach comes from the field of neuroevolution, which harnesses evolutionary algorithms to optimize neural networks, inspired by the fact that natural brains themselves are the products of an evolutionary process. Neuroevolution enables important capabilities that are typically unavailable to gradient-based approaches, including learning neural network building blocks (for example activation functions), hyperparameters, architectures and even the algorithms for learning themselves. Neuroevolution also differs from deep learning (and deep reinforcement learning) by maintaining a population of solutions during search, enabling extreme exploration and massive parallelization. Finally, because neuroevolution research has (until recently) developed largely in isolation from gradient-based neural network research, it has developed many unique and effective techniques that should be effective in other machine learning areas too. This Review looks at several key aspects of modern neuroevolution, including large-scale computing, the benefits of novelty and diversity, the power of indirect encoding, and the field's contributions to meta-learning and architecture search. Our hope is to inspire renewed interest in the field as it meets the potential of the increasing computation available today, to highlight how many of its ideas can provide an exciting resource for inspiration and hybridization to the deep learning, deep reinforcement learning and machine learning communities, and to explain how neuroevolution could prove to be a critical tool in the long-term pursuit of artificial general intelligence. Deep neural networks have become very successful at certain machine learning tasks partly due to the widely adopted method of training called backpropagation. An alternative way to optimize neural networks is by using evolutionary algorithms, which, fuelled by the increase in computing power, offers a new range of capabilities and modes of learning.",EVOLUTION; ARCHITECTURES; ROBOTS; GAME,16,AI Fundamental Research,73,Deep Learning and Neural Networks,neuroevolution; evolutionary algorithms; stochastic gradient descent; neural network weights; activation functions; hyperparameters; architecture search; meta-learning; indirect encoding; large-scale computing; deep reinforcement learning; backpropagation; neural network building blocks; population of solutions; extreme exploration; massive parallelization,16,,,neuroevolution; evolutionary algorithms; stochastic gradient descent; neural network weights; activation functions; architecture search; meta-learning; deep reinforcement learning; backpropagation; neural network building blocks,neuroevolution; evolutionary algorithms; stochastic gradient descent; neural network weights; activation functions; architecture search; meta-learning; deep reinforcement learning; backpropagation; neural network building blocks,neuroevolution; evolutionary algorithms; stochastic gradient descent; neural network weights; activation functions; architecture search; meta-learning; deep reinforcement learning; backpropagation; neural network building blocks
114,2021,COMPUTER SCIENCE,"Review of deep learning: concepts, CNN architectures, challenges, applications, future directions","In the last few years, the deep learning (DL) computing paradigm has been deemed the Gold Standard in the machine learning (ML) community. Moreover, it has gradually become the most widely used computational approach in the field of ML, thus achieving outstanding results on several complex cognitive tasks, matching or even beating those provided by human performance. One of the benefits of DL is the ability to learn massive amounts of data. The DL field has grown fast in the last few years and it has been extensively used to successfully address a wide range of traditional applications. More importantly, DL has outperformed well-known ML techniques in many domains, e.g., cybersecurity, natural language processing, bioinformatics, robotics and control, and medical information processing, among many others. Despite it has been contributed several works reviewing the State-of-the-Art on DL, all of them only tackled one aspect of the DL, which leads to an overall lack of knowledge about it. Therefore, in this contribution, we propose using a more holistic approach in order to provide a more suitable starting point from which to develop a full understanding of DL. Specifically, this review attempts to provide a more comprehensive survey of the most important aspects of DL and including those enhancements recently added to the field. In particular, this paper outlines the importance of DL, presents the types of DL techniques and networks. It then presents convolutional neural networks (CNNs) which the most utilized DL network type and describes the development of CNNs architectures together with their main features, e.g., starting with the AlexNet network and closing with the High-Resolution network (HR.Net). Finally, we further present the challenges and suggested solutions to help researchers understand the existing research gaps. It is followed by a list of the major DL applications. Computational tools including FPGA, GPU, and CPU are summarized along with a description of their influence on DL. The paper ends with the evolution matrix, benchmark datasets, and summary and conclusion.",Deep learning; Machine learning; Convolution neural network (CNN); Deep neural network architectures; Deep learning applications; Image classification; Transfer learning; Medical image analysis; Supervised learning; FPGA; GPU; CONVOLUTIONAL NEURAL-NETWORKS; BRAIN-TUMOR SEGMENTATION; X-RAY IMAGES; OF-THE-ART; COMPUTER-AIDED DETECTION; AUTOMATIC SEGMENTATION; CANCER CLASSIFICATION; PNEUMONIA DETECTION; MITOSIS DETECTION; DATA AUGMENTATION,16,AI Fundamental Research,73,Deep Learning and Neural Networks,deep learning; convolutional neural networks; AlexNet; High-Resolution network; HR.Net; FPGA; GPU; CPU,8,,,deep learning; convolutional neural networks; high-resolution network,deep learning; convolutional neural networks; high-resolution network,deep learning; convolutional neural networks; high-resolution network
137,2019,COMPUTER SCIENCE,Deep learning in spiking neural networks,"In recent years, deep learning has revolutionized the field of machine learning, for computer vision in particular. In this approach, a deep (multilayer) artificial neural network (ANN) is trained, most often in a supervised manner using backpropagation. Vast amounts of labeled training examples are required, but the resulting classification accuracy is truly impressive, sometimes outperforming humans. Neurons in an ANN are characterized by a single, static, continuous-valued activation. Yet biological neurons use discrete spikes to compute and transmit information, and the spike times, in addition to the spike rates, matter. Spiking neural networks (SNNs) are thus more biologically realistic than ANNs, and are arguably the only viable option if one wants to understand how the brain computes at the neuronal description level. The spikes of biological neurons are sparse in time and space, and event-driven. Combined with bio-plausible local learning rules, this makes it easier to build low-power, neuromorphic hardware for SNNs. However, training deep SNNs remains a challenge. Spiking neurons' transfer function is usually non-differentiable, which prevents using backpropagation. Here we review recent supervised and unsupervised methods to train deep SNNs, and compare them in terms of accuracy and computational cost. The emerging picture is that SNNs still lag behind ANNs in terms of accuracy, but the gap is decreasing, and can even vanish on some tasks, while SNNs typically require many fewer operations and are the better candidates to process spatio-temporal data. (C) 2018 Elsevier Ltd. All rights reserved.",Deep learning; Spiking neural network; Biological plausibility; Machine learning; Power-efficient architecture; TIMING-DEPENDENT PLASTICITY; BELIEF NETWORK; TEMPORAL PRECISION; RECEPTIVE FIELDS; ADAPTIVE NETWORK; GRADIENT DESCENT; VISUAL FEATURES; SPARSE CODE; NEURONS; MODEL,16,AI Fundamental Research,73,Deep Learning and Neural Networks,deep learning; spiking neural networks; artificial neural network; backpropagation; supervised learning; unsupervised learning; neuromorphic hardware; bio-plausible local learning rules; spatio-temporal data,9,,,deep learning; spiking neural networks; artificial neural network; backpropagation; supervised learning; unsupervised learning; neuromorphic hardware; bio-plausible local learning rules; spatio-temporal data,deep learning; spiking neural networks; artificial neural network; backpropagation; supervised learning; unsupervised learning; neuromorphic hardware; bio-plausible local learning rules; spatio-temporal data,deep learning; spiking neural networks; artificial neural network; backpropagation; supervised learning; unsupervised learning; neuromorphic hardware; bio-plausible local learning rules; spatio-temporal data
139,2014,ENGINEERING,Big Data Deep Learning: Challenges and Perspectives,"Deep learning is currently an extremely active research area in machine learning and pattern recognition society. It has gained huge successes in a broad area of applications such as speech recognition, computer vision, and natural language processing. With the sheer size of data available today, big data brings big opportunities and transformative potential for various sectors; on the other hand, it also presents unprecedented challenges to harnessing data and information. As the data keeps getting bigger, deep learning is coming to play a key role in providing big data predictive analytics solutions. In this paper, we provide a brief overview of deep learning, and highlight current research efforts and the challenges to big data, as well as the future trends.",Classifier design and evaluation; feature representation; machine learning; neural nets models; parallel processing; TIME ADAPTIVE CLASSIFIERS; NEURAL-NETWORKS; PATTERN-CLASSIFICATION; BACKPROPAGATION; ARCHITECTURE; STACKING; NETS,16,AI Fundamental Research,73,Deep Learning and Neural Networks,deep learning; big data; predictive analytics; speech recognition; natural language processing,5,,,deep learning; big data,deep learning; big data,deep learning; big data
145,2024,COMPUTER SCIENCE,Deep Neural Networks and Tabular Data: A Survey,"Heterogeneous tabular data are the most commonly used form of data and are essential for numerous critical and computationally demanding applications. On homogeneous datasets, deep neural networks have repeatedly shown excellent performance and have therefore been widely adopted. However, their adaptation to tabular data for inference or data generation tasks remains highly challenging. To facilitate further progress in the field, this work provides an overview of state-of-the-art deep learning methods for tabular data. We categorize these methods into three groups: data transformations, specialized architectures, and regularization models. For each of these groups, our work offers a comprehensive overview of the main approaches. Moreover, we discuss deep learning approaches for generating tabular data and also provide an overview over strategies for explaining deep models on tabular data. Thus, our first contribution is to address the main research streams and existing methodologies in the mentioned areas while highlighting relevant challenges and open research questions. Our second contribution is to provide an empirical comparison of traditional machine learning methods with 11 deep learning approaches across five popular real-world tabular datasets of different sizes and with different learning objectives. Our results, which we have made publicly available as competitive benchmarks, indicate that algorithms based on gradient-boosted tree ensembles still mostly outperform deep learning models on supervised learning tasks, suggesting that the research progress on competitive deep learning models for tabular data is stagnating. To the best of our knowledge, this is the first in-depth overview of deep learning approaches for tabular data; as such, this work can serve as a valuable starting point to guide researchers and practitioners interested in deep learning with tabular data.",Deep learning; Neural networks; Data models; Task analysis; Predictive models; Training; Probabilistic logic; Benchmark; deep neural networks; discrete data; heterogeneous data; interpretability; probabilistic modeling; survey; tabular data; tabular data generation,16,AI Fundamental Research,73,Deep Learning and Neural Networks,deep neural networks; tabular data; data transformations; specialized architectures; regularization models; gradient-boosted tree ensembles; supervised learning tasks; deep learning models; deep learning approaches; explaining deep models,10,,,deep neural networks; tabular data; data transformations; specialized architectures; regularization models; gradient-boosted tree ensembles; supervised learning tasks; deep learning models; deep learning approaches; explaining deep models,deep neural networks; tabular data; data transformations; specialized architectures; regularization models; gradient-boosted tree ensembles; supervised learning tasks; deep learning models; deep learning approaches; explaining deep models,deep neural networks; tabular data; data transformations; specialized architectures; regularization models; gradient-boosted tree ensembles; supervised learning tasks; deep learning models; deep learning approaches; explaining deep models
153,2017,PHYSICS,Why Does Deep and Cheap Learning Work So Well?,"We show how the success of deep learning could depend not only on mathematics but also on physics: although well-known mathematical theorems guarantee that neural networks can approximate arbitrary functions well, the class of functions of practical interest can frequently be approximated through ""cheap learning"" with exponentially fewer parameters than generic ones. We explore how properties frequently encountered in physics such as symmetry, locality, compositionality, and polynomial log-probability translate into exceptionally simple neural networks. We further argue that when the statistical process generating the data is of a certain hierarchical form prevalent in physics and machine learning, a deep neural network can be more efficient than a shallow one. We formalize these claims using information theory and discuss the relation to the renormalization group. We prove various ""no-flattening theorems"" showing when efficient linear deep networks cannot be accurately approximated by shallow ones without efficiency loss; for example, we show that n variables cannot be multiplied using fewer than neurons in a single hidden layer.",Artificial neural networks; Deep learning; Statistical physics; INFORMATION,16,AI Fundamental Research,73,Deep Learning and Neural Networks,deep learning; neural networks; cheap learning; symmetry; locality; compositionality; polynomial log-probability; hierarchical form; information theory; renormalization group; no-flattening theorems; efficient linear deep networks; shallow networks,13,,cheap learning; no-flattening theorems,deep learning; neural networks; cheap learning; information theory; renormalization group; efficient linear deep networks; shallow networks,neural networks; information theory; renormalization group; efficient linear deep networks; shallow networks,no-flattening theorems; cheap learning; neural networks; information theory; renormalization group; efficient linear deep networks; shallow networks
159,2017,ENGINEERING,Deep Multimodal Learning <i>A survey on recent advances and trends</i>,"The success of deep learning has been a catalyst to solving increasingly complex machine-learning problems, which often involve multiple data modalities. We review recent advances in deep multimodal learning and highlight the state-of the art, as well as gaps and challenges in this active research field. We first classify deep multimodal learning architectures and then discuss methods to fuse learned multimodal representations in deep-learning architectures. We highlight two areas of research-regularization strategies and methods that learn or optimize multimodal fusion structures-as exciting areas for future work.",NEURAL-NETWORKS; FUSION; ALGORITHMS,16,AI Fundamental Research,73,Deep Learning and Neural Networks,deep multimodal learning; multimodal representations; regularization strategies; multimodal fusion structures,4,,,deep multimodal learning; multimodal representations; regularization strategies; multimodal fusion structures,deep multimodal learning; multimodal representations; regularization strategies; multimodal fusion structures,deep multimodal learning; multimodal representations; regularization strategies; multimodal fusion structures
161,2021,COMPUTER SCIENCE,A Comprehensive Survey on Graph Neural Networks,"Deep learning has revolutionized many machine learning tasks in recent years, ranging from image classification and video processing to speech recognition and natural language understanding. The data in these tasks are typically represented in the Euclidean space. However, there is an increasing number of applications, where data are generated from non-Euclidean domains and are represented as graphs with complex relationships and interdependency between objects. The complexity of graph data has imposed significant challenges on the existing machine learning algorithms. Recently, many studies on extending deep learning approaches for graph data have emerged. In this article, we provide a comprehensive overview of graph neural networks (GNNs) in data mining and machine learning fields. We propose a new taxonomy to divide the state-of-the-art GNNs into four categories, namely, recurrent GNNs, convolutional GNNs, graph autoencoders, and spatial-temporal GNNs. We further discuss the applications of GNNs across various domains and summarize the open-source codes, benchmark data sets, and model evaluation of GNNs. Finally, we propose potential research directions in this rapidly growing field.",Deep learning; Neural networks; Task analysis; Kernel; Feature extraction; Data mining; Learning systems; Deep learning; graph autoencoder (GAE); graph convolutional networks (GCNs); graph neural networks (GNNs); graph representation learning; network embedding; CONVOLUTIONAL NETWORKS; CLASSIFICATION,16,AI Fundamental Research,73,Deep Learning and Neural Networks,graph neural networks; recurrent GNNs; convolutional GNNs; graph autoencoders; spatial-temporal GNNs,5,,graph neural networks; graph autoencoders,graph neural networks; convolutional gnns; graph autoencoders,convolutional gnns,graph neural networks; graph autoencoders; convolutional gnns
179,2023,COMPUTER SCIENCE,Learning From Noisy Labels With Deep Neural Networks: A Survey,"Deep learning has achieved remarkable success in numerous domains with help from large amounts of big data. However, the quality of data labels is a concern because of the lack of high-quality labels in many real-world scenarios. As noisy labels severely degrade the generalization performance of deep neural networks, learning from noisy labels (robust training) is becoming an important task in modern deep learning applications. In this survey, we first describe the problem of learning with label noise from a supervised learning perspective. Next, we provide a comprehensive review of 62 state-of-the-art robust training methods, all of which are categorized into five groups according to their methodological difference, followed by a systematic comparison of six properties used to evaluate their superiority. Subsequently, we perform an in-depth analysis of noise rate estimation and summarize the typically used evaluation methodology, including public noisy datasets and evaluation metrics. Finally, we present several promising research directions that can serve as a guideline for future studies.",Noise measurement; Training; Deep learning; Training data; Task analysis; Taxonomy; Data models; Classification; deep learning; label noise; noisy label; robust deep learning; robust optimization; survey,16,AI Fundamental Research,73,Deep Learning and Neural Networks,deep neural networks; noisy labels; robust training; supervised learning; noise rate estimation; state-of-the-art robust training methods; evaluation methodology,7,,,deep neural networks; robust training; supervised learning; state-of-the-art robust training methods,deep neural networks; robust training; supervised learning; state-of-the-art robust training methods,deep neural networks; robust training; supervised learning; state-of-the-art robust training methods
197,2021,COMPUTER SCIENCE,A survey on deep learning and its applications,"Deep learning, a branch of machine learning, is a frontier for artificial intelligence, aiming to be closer to its primary goal-artificial intelligence. This paper mainly adopts the summary and the induction methods of deep learning. Firstly, it introduces the global development and the current situation of deep learning. Secondly, it describes the structural principle, the characteristics, and some kinds of classic models of deep learning, such as stacked auto encoder, deep belief network, deep Boltzmann machine, and convolutional neural network. Thirdly, it presents the latest developments and applications of deep learning in many fields such as speech processing, computer vision, natural language processing, and medical applications. Finally, it puts forward the problems and the future research directions of deep learning. (C) 2021 Elsevier Inc. All rights reserved.",Deep learning; Stacked auto encoder; Deep belief networks; Deep Boltzmann machine; Convolutional neural network; OBJECT DETECTION; NEURAL-NETWORKS; VEHICLE DETECTION; IMAGE; CLASSIFICATION; SEGMENTATION; ALGORITHM; DROPOUT; SYSTEMS,16,AI Fundamental Research,73,Deep Learning and Neural Networks,stacked auto encoder; deep belief network; deep Boltzmann machine; convolutional neural network; speech processing; natural language processing,6,,,deep belief network; convolutional neural network,deep belief network; convolutional neural network,deep belief network; convolutional neural network
