paper_id,year,category,title,abstract,keywords,group_num,group_name,topic_id,topic_name,r1_terms,r1_term_count,annot_missing_terms,annot_important_terms,model_r2_terms,model_additional_terms,combined_important_terms
15889,2019,ENGINEERING,Eyeriss v2: A Flexible Accelerator for Emerging Deep Neural Networks on Mobile Devices,"A recent trend in deep neural network (DNN) development is to extend the reach of deep learning applications to platforms that are more resource and energy-constrained, e.g., mobile devices. These endeavors aim to reduce the DNN model size and improve the hardware processing efficiency and have resulted in DNNs that are much more compact in their structures and/or have high data sparsity. These compact or sparse models are different from the traditional large ones in that there is much more variation in their layer shapes and sizes and often require specialized hardware to exploit sparsity for performance improvement. Therefore, many DNN accelerators designed for large DNNs do not perform well on these models. In this paper, we present Eyeriss v2, a DNN accelerator architecture designed for running compact and sparse DNNs. To deal with the widely varying layer shapes and sizes, it introduces a highly flexible on-chip network, called hierarchical mesh, that can adapt to the different amounts of data reuse and bandwidth requirements of different data types, which improves the utilization of the computation resources. Furthermore, Eyeriss v2 can process sparse data directly in the compressed domain for both weights and activations and therefore is able to improve both processing speed and energy efficiency with sparse models. Overall, with sparse MobileNet, Eyeriss v2 in a 65-nm CMOS process achieves a throughput of 1470.6 inferences/s and 25603 inferences/J at a batch size of 1, which is 12.6x faster and 2.5x more energy-efficient than the original Eyeriss running MobileNet.",Deep neural network accelerators; deep learning; energy-efficient accelerators; dataflow processing; spatial architecture,16,AI Fundamental Research,73,Deep Learning and Neural Networks,Eyeriss v2; DNN accelerator architecture; hierarchical mesh; sparse MobileNet; compressed domain processing; 65-nm CMOS process,6,,Eyeriss v2; hierarchical mesh,dnn accelerator architecture; sparse mobilenet,dnn accelerator architecture; sparse mobilenet,hierarchical mesh; eyeriss v2; dnn accelerator architecture; sparse mobilenet
15900,2022,ENGINEERING,Line Graph Neural Networks for Link Prediction,"We consider the graph link prediction task, which is a classic graph analytical problem with many real-world applications. With the advances of deep learning, current link prediction methods commonly compute features from subgraphs centered at two neighboring nodes and use the features to predict the label of the link between these two nodes. In this formalism, a link prediction problem is converted to a graph classification task. In order to extract fixed-size features for classification, graph pooling layers are necessary in the deep learning model, thereby incurring information loss. To overcome this key limitation, we propose to seek a radically different and novel path by making use of the line graphs in graph theory. In particular, each node in a line graph corresponds to a unique edge in the original graph. Therefore, link prediction problems in the original graph can be equivalently solved as a node classification problem in its corresponding line graph, instead of a graph classification task. Experimental results on fourteen datasets from different applications demonstrate that our proposed method consistently outperforms the state-of-the-art methods, while it has fewer parameters and high training efficiency.",Feature extraction; Task analysis; Predictive models; Graph neural networks; Convolution; Deep learning; Topology; Deep learning; graph analysis; link prediction; graph neural networks; line graphs,16,AI Fundamental Research,73,Deep Learning and Neural Networks,graph link prediction; deep learning model; graph pooling layers; line graphs; node classification problem; graph classification task,6,,Line Graph Neural Networks,graph link prediction; deep learning model; graph pooling layers; line graphs; node classification problem; graph classification task,graph link prediction; deep learning model; graph pooling layers; node classification problem; graph classification task,line graph neural networks; graph link prediction; deep learning model; graph pooling layers; node classification problem; graph classification task
16007,2020,PHYSICS,Locally adaptive activation functions with slope recovery for deep and physics-informed neural networks,"We propose two approaches of locally adaptive activation functions namely, layer-wise and neuron-wise locally adaptive activation functions, which improve the performance of deep and physics-informed neural networks. The local adaptation of activation function is achieved by introducing a scalable parameter in each layer (layer-wise) and for every neuron (neuron-wise) separately, and then optimizing it using a variant of stochastic gradient descent algorithm. In order to further increase the training speed, an activation slope-based slope recovery term is added in the loss function, which further accelerates convergence, thereby reducing the training cost. On the theoretical side, we prove that in the proposed method, the gradient descent algorithms are not attracted to sub-optimal critical points or local minima under practical conditions on the initialization and learning rate, and that the gradient dynamics of the proposed method is not achievable by base methods with any (adaptive) learning rates. We further show that the adaptive activation methods accelerate the convergence by implicitly multiplying conditioning matrices to the gradient of the base method without any explicit computation of the conditioning matrix and the matrix-vector product. The different adaptive activation functions are shown to induce different implicit conditioning matrices. Furthermore, the proposed methods with the slope recovery are shown to accelerate the training process.",physics-informed neural networks; machine learning; bad minima; stochastic gradients; accelerated training; deep learning benchmarks,16,AI Fundamental Research,73,Deep Learning and Neural Networks,locally adaptive activation functions; layer-wise locally adaptive activation functions; neuron-wise locally adaptive activation functions; stochastic gradient descent algorithm; activation slope-based slope recovery term; gradient descent algorithms; implicit conditioning matrices; matrix-vector product,8,,locally adaptive activation functions; slope recovery,locally adaptive activation functions; layer-wise locally adaptive activation functions; neuron-wise locally adaptive activation functions; stochastic gradient descent algorithm; gradient descent algorithms,stochastic gradient descent algorithm; gradient descent algorithms,slope recovery; locally adaptive activation functions; stochastic gradient descent algorithm; gradient descent algorithms
16011,2018,Multidisciplinary,Equivalent-accuracy accelerated neural-network training using analogue memory,"Neural-network training can be slow and energy intensive, owing to the need to transfer the weight data for the network between conventional digital memory chips and processor chips. Analogue non-volatile memory can accelerate the neural-network training algorithm known as backpropagation by performing parallelized multiply-accumulate operations in the analogue domain at the location of the weight data. However, the classification accuracies of such in situ training using non-volatile-memory hardware have generally been less than those of software-based training, owing to insufficient dynamic range and excessive weight-update asymmetry. Here we demonstrate mixed hardware-software neural-network implementations that involve up to 204,900 synapses and that combine long-term storage in phase-change memory, near-linear updates of volatile capacitors and weight-data transfer with 'polarity inversion' to cancel out inherent device-to-device variations. We achieve generalization accuracies (on previously unseen data) equivalent to those of software-based training on various commonly used machine-learning test datasets (MNIST, MNIST-backrand, CIFAR-10 and CIFAR-100). The computational energy efficiency of 28,065 billion operations per second per watt and throughput per area of 3.6 trillion operations per second per square millimetre that we calculate for our implementation exceed those of today's graphical processing units by two orders of magnitude. This work provides a path towards hardware accelerators that are both fast and energy efficient, particularly on fully connected neural-network layers.",SYNAPSES; DEVICES,16,AI Fundamental Research,73,Deep Learning and Neural Networks,backpropagation; analogue non-volatile memory; parallelized multiply-accumulate operations; in situ training; phase-change memory; volatile capacitors; weight-data transfer; polarity inversion; device-to-device variations; fully connected neural-network layers,10,,analogue non-volatile memory; phase-change memory,backpropagation; in situ training; weight-data transfer,backpropagation; in situ training; weight-data transfer,analogue non-volatile memory; phase-change memory; backpropagation; in situ training; weight-data transfer
16133,2021,COMPUTER SCIENCE,Understanding Deep Learning (Still) Requires Rethinking Generalization,"Despite their massive size, successful deep artificial neural networks can exhibit a remarkably small gap between training and test performance. Conventional wisdom attributes small generalization error either to properties of the model family or to the regularization techniques used during training. Through extensive systematic experiments, we show how these traditional approaches fail to explain why large neural networks generalize well in practice. Specifically, our experiments establish that state-of-the-art convolutional networks for image classification trained with stochastic gradient methods easily fit a random labeling of the training data. This phenomenon is qualitatively unaffected by explicit regularization and occurs even if we replace the true images by completely unstructured random noise. We corroborate these experimental findings with a theoretical construction showing that simple depth two neural networks already have perfect finite sample expressivity as soon as the number of parameters exceeds the number of data points as it usually does in practice. We interpret our experimental findings by comparison with traditional models. We supplement this republication with a new section at the end summarizing recent progresses in the field since the original version of this paper.",,16,AI Fundamental Research,73,Deep Learning and Neural Networks,deep artificial neural networks; generalization error; regularization techniques; stochastic gradient methods; convolutional networks; image classification; finite sample expressivity,7,,,deep artificial neural networks; regularization techniques; stochastic gradient methods; convolutional networks; image classification,deep artificial neural networks; regularization techniques; stochastic gradient methods; convolutional networks; image classification,deep artificial neural networks; regularization techniques; stochastic gradient methods; convolutional networks; image classification
16239,2020,NEUROSCIENCE & BEHAVIOR,Enabling Spike-Based Backpropagation for Training Deep Neural Network Architectures,"Spiking Neural Networks (SNNs) have recently emerged as a prominent neural computing paradigm. However, the typical shallow SNN architectures have limited capacity for expressing complex representations while training deep SNNs using input spikes has not been successful so far. Diverse methods have been proposed to get around this issue such as converting off-the-shelf trained deep Artificial Neural Networks (ANNs) to SNNs. However, the ANN-SNN conversion scheme fails to capture the temporal dynamics of a spiking system. On the other hand, it is still a difficult problem to directly train deep SNNs using input spike events due to the discontinuous, non-differentiable nature of the spike generation function. To overcome this problem, we propose an approximate derivative method that accounts for the leaky behavior of LIF neurons. This method enables training deep convolutional SNNs directly (with input spike events) using spike-based backpropagation. Our experiments show the effectiveness of the proposed spike-based learning on deep networks (VGG and Residual architectures) by achieving the best classification accuracies in MNIST, SVHN, and CIFAR-10 datasets compared to other SNNs trained with a spike-based learning. Moreover, we analyze sparse event-based computations to demonstrate the efficacy of the proposed SNN training method for inference operation in the spiking domain.",spiking neural network; convolutional neural network; spike-based learning rule; gradient descent backpropagation; leaky integrate and fire neuron; MODEL,16,AI Fundamental Research,73,Deep Learning and Neural Networks,Spiking Neural Networks; ANN-SNN conversion; approximate derivative method; leaky behavior of LIF neurons; spike-based backpropagation; deep convolutional SNNs; spike-based learning; sparse event-based computations,8,,spike-based backpropagation,spiking neural networks; ann-snn conversion; spike-based backpropagation; deep convolutional snns; spike-based learning,spiking neural networks; ann-snn conversion; deep convolutional snns,spike-based backpropagation; spiking neural networks; ann-snn conversion; deep convolutional snns
16336,2017,COMPUTER SCIENCE,Structured Pruning of Deep Convolutional Neural Networks,"Real-time application of deep learning algorithms is often hindered by high computational complexity and frequent memory accesses. Network pruning is a promising technique to solve this problem. However, pruning usually results in irregular network connections that not only demand extra representation efforts but also do not fit well on parallel computation. We introduce structured sparsity at various scales for convolutional neural networks: feature map-wise, kernel-wise, and intra-kernel strided sparsity. This structured sparsity is very advantageous for direct computational resource savings on embedded computers, in parallel computing environments, and in hardware-based systems. To decide the importance of network connections and paths, the proposed method uses a particle filtering approach. The importance weight of each particle is assigned by assessing the misclassification rate with a corresponding connectivity pattern. The pruned network is retrained to compensate for the losses due to pruning. While implementing convolutions as matrix products, we particularly show that intra-kernel strided sparsity with a simple constraint can significantly reduce the size of the kernel and feature map tensors. The proposed work shows that when pruning granularities are applied in combination, we can prune the CIFAR-10 network by more than 70% with less than a 1% loss in accuracy.",Deep convolutional neural networks; structured pruning; feature map pruning; intra-kernel strided sparsity; PARTICLE FILTERS,16,AI Fundamental Research,73,Deep Learning and Neural Networks,structured pruning; deep convolutional neural networks; network pruning; structured sparsity; feature map-wise; kernel-wise; intra-kernel strided sparsity; particle filtering approach; misclassification rate; connectivity pattern; pruned network retraining; convolutions as matrix products; intra-kernel strided sparsity constraint; kernel and feature map tensors reduction; pruning granularities,15,,structured pruning; structured sparsity,deep convolutional neural networks; network pruning; structured sparsity; intra-kernel strided sparsity; pruned network retraining; intra-kernel strided sparsity constraint,deep convolutional neural networks; pruned network retraining,structured sparsity; structured pruning; deep convolutional neural networks; pruned network retraining
16395,2014,ENGINEERING,Application of Deep Belief Networks for Natural Language Understanding,"Applications of Deep Belief Nets (DBN) to various problems have been the subject of a number of recent studies ranging from image classification and speech recognition to audio classification. In this study we apply DBNs to a natural language understanding problem. The recent surge of activity in this area was largely spurred by the development of a greedy layer-wise pretraining method that uses an efficient learning algorithm called Contrastive Divergence (CD). CD allows DBNs to learn a multi-layer generative model from unlabeled data and the features discovered by this model are then used to initialize a feed-forward neural network which is fine-tuned with backpropagation. We compare a DBN-initialized neural network to three widely used text classification algorithms: Support Vector Machines (SVM), boosting and Maximum Entropy (MaxEnt). The plain DBN-based model gives a call-routing classification accuracy that is equal to the best of the other models. However, using additional unlabeled data for DBN pre-training and combining DBN-based learned features with the original features provides significant gains over SVMs, which, in turn, performed better than both MaxEnt and Boosting.",Call-Routing; DBN; Deep Learning; Deep Neural Nets; Natural language Understanding; RBM,16,AI Fundamental Research,73,Deep Learning and Neural Networks,Deep Belief Networks; Contrastive Divergence; greedy layer-wise pretraining; feed-forward neural network; backpropagation; Support Vector Machines; Maximum Entropy; text classification algorithms; DBN-initialized neural network; unlabeled data; DBN pre-training; learned features,12,,,deep belief networks; greedy layer-wise pretraining; feed-forward neural network; backpropagation; text classification algorithms; dbn-initialized neural network; unlabeled data,deep belief networks; greedy layer-wise pretraining; feed-forward neural network; backpropagation; text classification algorithms; dbn-initialized neural network; unlabeled data,deep belief networks; greedy layer-wise pretraining; feed-forward neural network; backpropagation; text classification algorithms; dbn-initialized neural network; unlabeled data
16458,2014,COMPUTER SCIENCE,"An Insight into Extreme Learning Machines: Random Neurons, Random Features and Kernels","Extreme learning machines (ELMs) basically give answers to two fundamental learning problems: (1) Can fundamentals of learning (i.e., feature learning, clustering, regression and classification) be made without tuning hidden neurons (including biological neurons) even when the output shapes and function modeling of these neurons are unknown? (2) Does there exist unified framework for feedforward neural networks and feature space methods? ELMs that have built some tangible links between machine learning techniques and biological learning mechanisms have recently attracted increasing attention of researchers in widespread research areas. This paper provides an insight into ELMs in three aspects, viz: random neurons, random features and kernels. This paper also shows that in theory ELMs (with the same kernels) tend to outperform support vector machine and its variants in both regression and classification applications with much easier implementation.",Extreme learning machine; Support vector machine; Least square support vector machine; ELM kernel; Random neuron; Random feature; Randomized matrix; MIXED SELECTIVITY; NEURAL-NETWORKS; MODEL; CLASSIFICATION; APPROXIMATION; PERCEPTRON; ELMS; REPRESENTATIONS; INFORMATION; REGRESSION,16,AI Fundamental Research,73,Deep Learning and Neural Networks,Extreme Learning Machines; random neurons; random features; kernels; feedforward neural networks; feature space methods; support vector machine; regression applications; classification applications,9,,Extreme Learning Machines,extreme learning machines; feedforward neural networks; classification applications,feedforward neural networks; classification applications,extreme learning machines; feedforward neural networks; classification applications
16557,2018,ENGINEERING,"Model Compression and Acceleration for Deep Neural Networks <i>The principles, progress, and challenges</i>",,,16,AI Fundamental Research,73,Deep Learning and Neural Networks,Model Compression; Deep Neural Networks; Neural Network Pruning; Quantization Techniques; Knowledge Distillation; Low-Rank Factorization; Parameter Sharing; Efficient Convolutional Layers; Network Architecture Search; Sparse Representations,10,,,model compression; deep neural networks; neural network pruning; quantization techniques; parameter sharing; network architecture search; sparse representations,model compression; deep neural networks; neural network pruning; quantization techniques; parameter sharing; network architecture search; sparse representations,model compression; deep neural networks; neural network pruning; quantization techniques; parameter sharing; network architecture search; sparse representations
16562,2014,COMPUTER SCIENCE,DianNao: A Small-Footprint High-Throughput Accelerator for Ubiquitous Machine-Learning,"Machine-Learning tasks are becoming pervasive in a broad range of domains, and in a broad range of systems (from embedded systems to data centers). At the same time, a small set of machine-learning algorithms (especially Convolutional and Deep Neural Networks, i.e., CNNs and DNNs) are proving to be state-of-the-art across many applications. As architectures evolve towards heterogeneous multi-cores composed of a mix of cores and accelerators, a machine-learning accelerator can achieve the rare combination of efficiency (due to the small number of target algorithms) and broad application scope. Until now, most machine-learning accelerator designs have focused on efficiently implementing the computational part of the algorithms. However, recent state-of-the-art CNNs and DNNs are characterized by their large size. In this study, we design an accelerator for large-scale CNNs and DNNs, with a special emphasis on the impact of memory on accelerator design, performance and energy. We show that it is possible to design an accelerator with a high throughput, capable of performing 452 GOP/s (key NN operations such as synaptic weight multiplications and neurons outputs additions) in a small footprint of 3.02 mm(2) and 485 mW; compared to a 128-bit 2GHz SIMD processor, the accelerator is 117.87x faster, and it can reduce the total energy by 21.08x. The accelerator characteristics are obtained after layout at 65nm. Such a high throughput in a small footprint can open up the usage of state-of-the-art machine-learning algorithms in a broad set of systems and for a broad set of applications.",NEURAL-NETWORKS; RECOGNITION,16,AI Fundamental Research,73,Deep Learning and Neural Networks,Convolutional Neural Networks; Deep Neural Networks; machine-learning accelerator; synaptic weight multiplications; neurons outputs additions; heterogeneous multi-cores; high throughput accelerator; memory impact on accelerator design; small footprint design; energy efficiency in accelerators,10,,DianNao,convolutional neural networks; deep neural networks,convolutional neural networks; deep neural networks,diannao; convolutional neural networks; deep neural networks
